{
  "$schema": "https://json-schema.org/draft/2020-12/schema",
  "title": "AuditEvent",
  "type": "object",
  "additionalProperties": false,
  "properties": {
    "id": {"type": "string", "minLength": 8},
    "timestamp": {"type": "string", "format": "date-time"},
    "tenant_id": {"type": "string", "minLength": 3},
    "action": {"type": "string", "minLength": 3},
    "outcome": {"type": "string", "enum": ["success", "failure", "denied"]},
    "classification": {"type": "string", "enum": ["public", "internal", "confidential", "restricted"]},
    "actor": {
      "type": "object",
      "additionalProperties": false,
      "properties": {
        "id": {"type": "string"},
        "type": {"type": "string", "enum": ["user", "service", "system"]},
        "roles": {"type": "array", "items": {"type": "string"}}
      },
      "required": ["id", "type", "roles"]
    },
    "resource": {
      "type": "object",
      "additionalProperties": false,
      "properties": {
        "id": {"type": "string"},
        "type": {"type": "string"},
        "attributes": {"type": "object"}
      },
      "required": ["id", "type"]
    },
    "metadata": {"type": "object"},
    "trace_id": {"type": "string"},
    "correlation_id": {"type": "string"}
  },
  "required": [
    "id",
    "timestamp",
    "tenant_id",
    "action",
    "outcome",
    "classification",
    "actor",
    "resource"
  ]
}
